"No.","Time","Source","Destination","Protocol","Length","Sequence Number","Acknowledgment Number","TCP Segment Len","Info"
"1","0.000000","10.135.49.223","172.16.17.32","DNS","95","","","","Standard query 0xd663 A optimizationguide-pa.googleapis.com"
"2","0.000456","10.135.49.223","172.16.17.32","DNS","95","","","","Standard query 0xb36a HTTPS optimizationguide-pa.googleapis.com"
"3","0.007685","10.135.49.223","128.119.245.12","TCP","54","1","1","0","63276  >  80 [FIN, ACK] Seq=1 Ack=1 Win=256 Len=0"
"4","0.007832","10.135.49.223","128.119.245.12","TCP","54","1","1","0","63275  >  80 [FIN, ACK] Seq=1 Ack=1 Win=256 Len=0"
"5","0.008077","10.135.49.223","128.119.245.12","TCP","54","1","1","0","63272  >  80 [FIN, ACK] Seq=1 Ack=1 Win=256 Len=0"
"6","0.008138","10.135.49.223","128.119.245.12","TCP","54","1","1","0","63273  >  80 [FIN, ACK] Seq=1 Ack=1 Win=256 Len=0"
"7","0.008437","10.135.49.223","128.119.245.12","TCP","54","1","1","0","63271  >  80 [FIN, ACK] Seq=1 Ack=1 Win=254 Len=0"
"8","0.008510","10.135.49.223","142.250.183.14","TCP","54","1","1","0","63228  >  443 [FIN, ACK] Seq=1 Ack=1 Win=255 Len=0"
"9","0.008852","10.135.49.223","142.250.183.174","TCP","54","1","1","0","63227  >  443 [FIN, ACK] Seq=1 Ack=1 Win=259 Len=0"
"10","0.009080","10.135.49.223","142.251.42.46","TCP","54","1","1","0","63224  >  443 [FIN, ACK] Seq=1 Ack=1 Win=253 Len=0"
"11","0.009177","10.135.49.223","142.250.192.3","TCP","54","1","1","0","63241  >  443 [FIN, ACK] Seq=1 Ack=1 Win=254 Len=0"
"12","0.009239","10.135.49.223","216.58.196.65","TCP","54","1","1","0","63240  >  443 [FIN, ACK] Seq=1 Ack=1 Win=259 Len=0"
"13","0.009326","10.135.49.223","142.250.183.174","TCP","54","1","1","0","63232  >  443 [FIN, ACK] Seq=1 Ack=1 Win=254 Len=0"
"14","0.009382","10.135.49.223","142.250.182.202","TCP","54","1","1","0","63269  >  443 [FIN, ACK] Seq=1 Ack=1 Win=253 Len=0"
"15","0.009613","10.135.49.223","142.250.192.142","TCP","54","1","1","0","63259  >  443 [FIN, ACK] Seq=1 Ack=1 Win=256 Len=0"
"16","0.009673","10.135.49.223","172.217.174.67","TCP","54","1","1","0","63234  >  443 [FIN, ACK] Seq=1 Ack=1 Win=254 Len=0"
"17","0.010043","10.135.49.223","142.250.183.131","TCP","54","1","1","0","63238  >  443 [FIN, ACK] Seq=1 Ack=1 Win=254 Len=0"
"18","0.010701","10.135.49.223","128.119.245.12","TCP","66","0","0","0","63344  >  80 [SYN] Seq=0 Win=64240 Len=0 MSS=1460 WS=256 SACK_PERM"
"19","0.011502","10.135.49.223","128.119.245.12","TCP","66","0","0","0","63345  >  80 [SYN] Seq=0 Win=64240 Len=0 MSS=1460 WS=256 SACK_PERM"
"20","0.014817","10.135.49.223","172.16.17.32","DNS","83","","","","Standard query 0x9c31 A safebrowsing.google.com"
"21","0.015189","10.135.49.223","172.16.17.32","DNS","83","","","","Standard query 0x131f HTTPS safebrowsing.google.com"
"22","0.029608","172.16.17.32","10.135.49.223","DNS","351","","","","Standard query response 0xd663 A optimizationguide-pa.googleapis.com A 142.250.183.138 A 142.250.182.234 A 142.250.77.74 A 142.250.182.202 A 172.217.166.170 A 142.250.66.10 A 142.250.71.106 A 142.250.199.138 A 142.250.183.202 A 142.250.67.234 A 142.250.183.170 A 142.251.42.42 A 172.217.27.202 A 172.217.160.202 A 142.250.77.42 A 142.250.183.10"
"23","0.038835","10.135.49.223","142.250.183.138","QUIC","1292","","","","Initial, DCID=385aadee51f44cfc, PKN: 1, PING, PING, CRYPTO, PING, PADDING, CRYPTO, CRYPTO, PING, CRYPTO, PADDING, CRYPTO, PING, CRYPTO, PING, CRYPTO, PING, PADDING, PING, CRYPTO, PADDING"
"24","0.040387","10.135.49.223","142.250.183.138","QUIC","123","","","","0-RTT, DCID=385aadee51f44cfc"
"25","0.043446","172.16.17.32","10.135.49.223","DNS","152","","","","Standard query response 0xb36a HTTPS optimizationguide-pa.googleapis.com SOA ns1.google.com"
"26","0.044876","172.16.17.32","10.135.49.223","DNS","118","","","","Standard query response 0x9c31 A safebrowsing.google.com CNAME sb.l.google.com A 142.251.42.14"
"27","0.051049","172.16.17.32","10.135.49.223","DNS","152","","","","Standard query response 0x131f HTTPS safebrowsing.google.com CNAME sb.l.google.com SOA ns1.google.com"
"28","0.052716","10.135.49.223","142.251.42.14","QUIC","1292","","","","Initial, DCID=2f14599a66e44a37, PKN: 1, PADDING, PING, CRYPTO, CRYPTO, PADDING, PING, PADDING, PING, PADDING, CRYPTO, PING, PADDING, PING, PADDING, CRYPTO, PING, CRYPTO"
"29","0.053006","10.135.49.223","172.217.19.14","TLSv1.2","280","1","1","226","Application Data"
"30","0.053100","10.135.49.223","172.217.19.14","TLSv1.2","93","227","1","39","Application Data"
"31","0.053191","10.135.49.223","172.217.19.14","TLSv1.2","519","266","1","465","Application Data"
"32","0.104880","172.217.19.14","10.135.49.223","TCP","54","1","227","0","443  >  63270 [ACK] Seq=1 Ack=227 Win=274 Len=0"
"33","0.104880","172.217.19.14","10.135.49.223","TCP","54","1","266","0","443  >  63270 [ACK] Seq=1 Ack=266 Win=274 Len=0"
"34","0.104929","172.217.19.14","10.135.49.223","TCP","54","1","731","0","443  >  63270 [ACK] Seq=1 Ack=731 Win=279 Len=0"
"35","0.104929","172.217.19.14","10.135.49.223","TLSv1.2","93","1","731","39","Application Data"
"36","0.159514","10.135.49.223","172.217.19.14","TCP","54","731","40","0","63270  >  443 [ACK] Seq=731 Ack=40 Win=258 Len=0"
"37","0.270531","10.135.49.223","128.119.245.12","TCP","66","0","0","0","63346  >  80 [SYN] Seq=0 Win=64240 Len=0 MSS=1460 WS=256 SACK_PERM"
"38","0.273303","172.217.19.14","10.135.49.223","TLSv1.2","124","40","731","70","Application Data"
"39","0.285424","172.217.19.14","10.135.49.223","TLSv1.2","145","110","731","91","Application Data"
"40","0.285424","172.217.19.14","10.135.49.223","TLSv1.2","85","201","731","31","Application Data"
"41","0.285424","172.217.19.14","10.135.49.223","TLSv1.2","93","232","731","39","Application Data"
"42","0.285536","10.135.49.223","172.217.19.14","TCP","54","731","271","0","63270  >  443 [ACK] Seq=731 Ack=271 Win=257 Len=0"
"43","0.286569","10.135.49.223","172.217.19.14","TLSv1.2","89","731","271","35","Application Data"
"44","0.286735","10.135.49.223","172.217.19.14","TLSv1.2","93","766","271","39","Application Data"
"45","0.326984","142.250.182.202","10.135.49.223","TCP","54","1","2","0","443  >  63269 [FIN, ACK] Seq=1 Ack=2 Win=264 Len=0"
"46","0.327068","10.135.49.223","142.250.182.202","TCP","54","2","2","0","63269  >  443 [ACK] Seq=2 Ack=2 Win=253 Len=0"
"47","0.342355","142.250.183.174","10.135.49.223","TCP","54","1","2","0","443  >  63232 [FIN, ACK] Seq=1 Ack=2 Win=264 Len=0"
"48","0.342355","142.250.183.14","10.135.49.223","TCP","54","1","2","0","443  >  63228 [FIN, ACK] Seq=1 Ack=2 Win=261 Len=0"
"49","0.342355","172.217.19.14","10.135.49.223","TCP","54","271","805","0","443  >  63270 [ACK] Seq=271 Ack=805 Win=279 Len=0"
"50","0.342355","142.250.183.174","10.135.49.223","TCP","54","1","2","0","443  >  63227 [FIN, ACK] Seq=1 Ack=2 Win=261 Len=0"
"51","0.342457","10.135.49.223","142.250.183.174","TCP","54","2","2","0","63232  >  443 [ACK] Seq=2 Ack=2 Win=254 Len=0"
"52","0.342628","10.135.49.223","142.250.183.14","TCP","54","2","2","0","63228  >  443 [ACK] Seq=2 Ack=2 Win=255 Len=0"
"53","0.342748","10.135.49.223","142.250.183.174","TCP","54","2","2","0","63227  >  443 [ACK] Seq=2 Ack=2 Win=259 Len=0"
"54","0.342877","142.250.183.131","10.135.49.223","TCP","54","1","2","0","443  >  63238 [FIN, ACK] Seq=1 Ack=2 Win=265 Len=0"
"55","0.342919","10.135.49.223","142.250.183.131","TCP","54","2","2","0","63238  >  443 [ACK] Seq=2 Ack=2 Win=254 Len=0"
"56","0.348305","10.135.49.223","142.250.183.138","QUIC","1292","","","","Initial, DCID=385aadee51f44cfc, PKN: 4, PING, PING, PADDING, CRYPTO, CRYPTO, PADDING, PING, CRYPTO, PING, PING, PING, PING"
"57","0.363789","10.135.49.223","142.251.42.14","QUIC","1292","","","","Initial, DCID=2f14599a66e44a37, PKN: 3, CRYPTO, PADDING, PING, PING, CRYPTO, CRYPTO, PADDING, CRYPTO, PADDING, CRYPTO"
"58","0.391091","142.250.183.138","10.135.49.223","QUIC","1292","","","","Initial, SCID=f85aadee51f44cfc, PKN: 1, ACK, PADDING"
"59","0.409116","128.119.245.12","10.135.49.223","TCP","54","1","0","0","80  >  63271 [RST] Seq=1 Win=0 Len=0"
"60","0.409116","128.119.245.12","10.135.49.223","TCP","54","1","0","0","80  >  63275 [RST] Seq=1 Win=0 Len=0"
"61","0.409116","128.119.245.12","10.135.49.223","TCP","66","0","1","0","80  >  63344 [SYN, ACK] Seq=0 Ack=1 Win=29200 Len=0 MSS=1460 SACK_PERM WS=128"
"62","0.409383","10.135.49.223","128.119.245.12","TCP","54","1","1","0","63344  >  80 [ACK] Seq=1 Ack=1 Win=65536 Len=0"
"63","0.411003","10.135.49.223","128.119.245.12","TCP","762","1","1","708","63344  >  80 [PSH, ACK] Seq=1 Ack=1 Win=65536 Len=708 [TCP segment of a reassembled PDU]"
"64","0.411904","10.135.49.223","128.119.245.12","TCP","1514","709","1","1460","63344  >  80 [ACK] Seq=709 Ack=1 Win=65536 Len=1460 [TCP segment of a reassembled PDU]"
"65","0.411904","10.135.49.223","128.119.245.12","TCP","1514","2169","1","1460","63344  >  80 [ACK] Seq=2169 Ack=1 Win=65536 Len=1460 [TCP segment of a reassembled PDU]"
"66","0.411904","10.135.49.223","128.119.245.12","TCP","1514","3629","1","1460","63344  >  80 [ACK] Seq=3629 Ack=1 Win=65536 Len=1460 [TCP segment of a reassembled PDU]"
"67","0.411904","10.135.49.223","128.119.245.12","TCP","1514","5089","1","1460","63344  >  80 [ACK] Seq=5089 Ack=1 Win=65536 Len=1460 [TCP segment of a reassembled PDU]"
"68","0.411904","10.135.49.223","128.119.245.12","TCP","1514","6549","1","1460","63344  >  80 [ACK] Seq=6549 Ack=1 Win=65536 Len=1460 [TCP segment of a reassembled PDU]"
"69","0.411904","10.135.49.223","128.119.245.12","TCP","1514","8009","1","1460","63344  >  80 [ACK] Seq=8009 Ack=1 Win=65536 Len=1460 [TCP segment of a reassembled PDU]"
"70","0.411904","10.135.49.223","128.119.245.12","TCP","1514","9469","1","1460","63344  >  80 [ACK] Seq=9469 Ack=1 Win=65536 Len=1460 [TCP segment of a reassembled PDU]"
"71","0.411904","10.135.49.223","128.119.245.12","TCP","1514","10929","1","1460","63344  >  80 [ACK] Seq=10929 Ack=1 Win=65536 Len=1460 [TCP segment of a reassembled PDU]"
"72","0.411904","10.135.49.223","128.119.245.12","TCP","1514","12389","1","1460","63344  >  80 [ACK] Seq=12389 Ack=1 Win=65536 Len=1460 [TCP segment of a reassembled PDU]"
"73","0.412330","128.119.245.12","10.135.49.223","TCP","66","0","1","0","80  >  63345 [SYN, ACK] Seq=0 Ack=1 Win=29200 Len=0 MSS=1460 SACK_PERM WS=128"
"74","0.412568","10.135.49.223","128.119.245.12","TCP","54","1","1","0","63345  >  80 [ACK] Seq=1 Ack=1 Win=65536 Len=0"
"75","0.423340","142.250.183.138","10.135.49.223","QUIC","1292","","","","Protected Payload (KP0)"
"76","0.423340","142.250.183.138","10.135.49.223","QUIC","856","","","","Protected Payload (KP0)"
"77","0.423593","142.250.183.138","10.135.49.223","QUIC","234","","","","Protected Payload (KP0)"
"78","0.423593","142.250.183.138","10.135.49.223","QUIC","66","","","","Protected Payload (KP0)"
"79","0.425316","10.135.49.223","142.250.183.138","QUIC","1292","","","","Handshake, DCID=f85aadee51f44cfc"
"80","0.425523","10.135.49.223","142.250.183.138","QUIC","115","","","","Handshake, DCID=f85aadee51f44cfc"
"81","0.426408","10.135.49.223","142.250.183.138","QUIC","73","","","","Protected Payload (KP0), DCID=f85aadee51f44cfc"
"82","0.427864","10.135.49.223","142.250.183.138","QUIC","563","","","","Protected Payload (KP0), DCID=f85aadee51f44cfc"
"83","0.494423","142.250.192.142","10.135.49.223","TCP","54","1","2","0","443  >  63259 [FIN, ACK] Seq=1 Ack=2 Win=263 Len=0"
"84","0.494423","216.58.196.65","10.135.49.223","TCP","54","1","2","0","443  >  63240 [FIN, ACK] Seq=1 Ack=2 Win=261 Len=0"
"85","0.494482","10.135.49.223","142.250.192.142","TCP","54","2","2","0","63259  >  443 [ACK] Seq=2 Ack=2 Win=256 Len=0"
"86","0.494582","10.135.49.223","216.58.196.65","TCP","54","2","2","0","63240  >  443 [ACK] Seq=2 Ack=2 Win=259 Len=0"
"87","0.494681","172.217.174.67","10.135.49.223","TCP","54","1","2","0","443  >  63234 [FIN, ACK] Seq=1 Ack=2 Win=264 Len=0"
"88","0.494681","142.251.42.46","10.135.49.223","TCP","54","1","2","0","443  >  63224 [FIN, ACK] Seq=1 Ack=2 Win=265 Len=0"
"89","0.494707","10.135.49.223","172.217.174.67","TCP","54","2","2","0","63234  >  443 [ACK] Seq=2 Ack=2 Win=254 Len=0"
"90","0.494797","10.135.49.223","142.251.42.46","TCP","54","2","2","0","63224  >  443 [ACK] Seq=2 Ack=2 Win=253 Len=0"
"91","0.501702","142.250.192.3","10.135.49.223","TCP","54","1","2","0","443  >  63241 [FIN, ACK] Seq=1 Ack=2 Win=261 Len=0"
"92","0.501793","10.135.49.223","142.250.192.3","TCP","54","2","2","0","63241  >  443 [ACK] Seq=2 Ack=2 Win=254 Len=0"
"93","0.541638","142.251.42.14","10.135.49.223","QUIC","1292","","","","Initial, SCID=ef14599a66e44a37, PKN: 1, ACK, CRYPTO, PADDING"
"94","0.544347","10.135.49.223","142.251.42.14","QUIC","1292","","","","Initial, DCID=ef14599a66e44a37, PKN: 4, ACK, PADDING"
"95","0.603837","142.250.183.138","10.135.49.223","QUIC","71","","","","Protected Payload (KP0)"
"96","0.603837","142.251.42.14","10.135.49.223","QUIC","1292","","","","Handshake, SCID=ef14599a66e44a37"
"97","0.603934","142.251.42.14","10.135.49.223","QUIC","1292","","","","Handshake, SCID=ef14599a66e44a37"
"98","0.604264","10.135.49.223","142.250.183.138","QUIC","76","","","","Protected Payload (KP0), DCID=f85aadee51f44cfc"
"99","0.604784","10.135.49.223","142.251.42.14","QUIC","81","","","","Handshake, DCID=ef14599a66e44a37"
"100","0.665906","128.119.245.12","10.135.49.223","TCP","66","0","1","0","80  >  63346 [SYN, ACK] Seq=0 Ack=1 Win=29200 Len=0 MSS=1460 SACK_PERM WS=128"
"101","0.666037","10.135.49.223","128.119.245.12","TCP","54","1","1","0","63346  >  80 [ACK] Seq=1 Ack=1 Win=65536 Len=0"
"102","0.669473","142.250.183.138","10.135.49.223","QUIC","1292","","","","Protected Payload (KP0)"
"103","0.669715","10.135.49.223","142.250.183.138","QUIC","78","","","","Protected Payload (KP0), DCID=f85aadee51f44cfc"
"104","0.749444","142.250.183.138","10.135.49.223","QUIC","163","","","","Protected Payload (KP0)"
"105","0.749678","10.135.49.223","142.250.183.138","QUIC","78","","","","Protected Payload (KP0), DCID=f85aadee51f44cfc"
"106","0.756258","142.250.183.138","10.135.49.223","QUIC","649","","","","Protected Payload (KP0)"
"107","0.756594","10.135.49.223","142.250.183.138","QUIC","79","","","","Protected Payload (KP0), DCID=f85aadee51f44cfc"
"108","0.761829","142.250.183.138","10.135.49.223","QUIC","244","","","","Protected Payload (KP0)"
"109","0.787376","10.135.49.223","142.250.183.138","QUIC","76","","","","Protected Payload (KP0), DCID=f85aadee51f44cfc"
"110","0.837654","128.119.245.12","10.135.49.223","TCP","54","1","709","0","80  >  63344 [ACK] Seq=1 Ack=709 Win=30720 Len=0"
"111","0.837654","128.119.245.12","10.135.49.223","TCP","54","1","13849","0","80  >  63344 [ACK] Seq=1 Ack=13849 Win=56960 Len=0"
"112","0.837872","10.135.49.223","128.119.245.12","TCP","1514","13849","1","1460","63344  >  80 [ACK] Seq=13849 Ack=1 Win=65536 Len=1460 [TCP segment of a reassembled PDU]"
"113","0.837872","10.135.49.223","128.119.245.12","TCP","1514","15309","1","1460","63344  >  80 [ACK] Seq=15309 Ack=1 Win=65536 Len=1460 [TCP segment of a reassembled PDU]"
"114","0.837872","10.135.49.223","128.119.245.12","TCP","1514","16769","1","1460","63344  >  80 [PSH, ACK] Seq=16769 Ack=1 Win=65536 Len=1460 [TCP segment of a reassembled PDU]"
"115","0.837872","10.135.49.223","128.119.245.12","TCP","1514","18229","1","1460","63344  >  80 [ACK] Seq=18229 Ack=1 Win=65536 Len=1460 [TCP segment of a reassembled PDU]"
"116","0.837872","10.135.49.223","128.119.245.12","TCP","1514","19689","1","1460","63344  >  80 [ACK] Seq=19689 Ack=1 Win=65536 Len=1460 [TCP segment of a reassembled PDU]"
"117","0.837872","10.135.49.223","128.119.245.12","TCP","1514","21149","1","1460","63344  >  80 [ACK] Seq=21149 Ack=1 Win=65536 Len=1460 [TCP segment of a reassembled PDU]"
"118","0.837872","10.135.49.223","128.119.245.12","TCP","1514","22609","1","1460","63344  >  80 [ACK] Seq=22609 Ack=1 Win=65536 Len=1460 [TCP segment of a reassembled PDU]"
"119","0.837872","10.135.49.223","128.119.245.12","TCP","1514","24069","1","1460","63344  >  80 [ACK] Seq=24069 Ack=1 Win=65536 Len=1460 [TCP segment of a reassembled PDU]"
"120","0.837872","10.135.49.223","128.119.245.12","TCP","1514","25529","1","1460","63344  >  80 [ACK] Seq=25529 Ack=1 Win=65536 Len=1460 [TCP segment of a reassembled PDU]"
"121","0.837872","10.135.49.223","128.119.245.12","TCP","1514","26989","1","1460","63344  >  80 [ACK] Seq=26989 Ack=1 Win=65536 Len=1460 [TCP segment of a reassembled PDU]"
"122","0.837872","10.135.49.223","128.119.245.12","TCP","1514","28449","1","1460","63344  >  80 [ACK] Seq=28449 Ack=1 Win=65536 Len=1460 [TCP segment of a reassembled PDU]"
"123","0.837872","10.135.49.223","128.119.245.12","TCP","1514","29909","1","1460","63344  >  80 [ACK] Seq=29909 Ack=1 Win=65536 Len=1460 [TCP segment of a reassembled PDU]"
"124","0.837872","10.135.49.223","128.119.245.12","TCP","1514","31369","1","1460","63344  >  80 [ACK] Seq=31369 Ack=1 Win=65536 Len=1460 [TCP segment of a reassembled PDU]"
"125","0.837872","10.135.49.223","128.119.245.12","TCP","1514","32829","1","1460","63344  >  80 [PSH, ACK] Seq=32829 Ack=1 Win=65536 Len=1460 [TCP segment of a reassembled PDU]"
"126","0.837872","10.135.49.223","128.119.245.12","TCP","1514","34289","1","1460","63344  >  80 [ACK] Seq=34289 Ack=1 Win=65536 Len=1460 [TCP segment of a reassembled PDU]"
"127","0.837872","10.135.49.223","128.119.245.12","TCP","1514","35749","1","1460","63344  >  80 [ACK] Seq=35749 Ack=1 Win=65536 Len=1460 [TCP segment of a reassembled PDU]"
"128","0.837872","10.135.49.223","128.119.245.12","TCP","1514","37209","1","1460","63344  >  80 [ACK] Seq=37209 Ack=1 Win=65536 Len=1460 [TCP segment of a reassembled PDU]"
"129","0.837872","10.135.49.223","128.119.245.12","TCP","1514","38669","1","1460","63344  >  80 [ACK] Seq=38669 Ack=1 Win=65536 Len=1460 [TCP segment of a reassembled PDU]"
"130","0.853448","142.251.42.14","10.135.49.223","QUIC","1292","","","","Handshake, SCID=ef14599a66e44a37"
"131","0.854334","10.135.49.223","142.251.42.14","QUIC","83","","","","Handshake, DCID=ef14599a66e44a37"
"132","0.858271","142.251.42.14","10.135.49.223","QUIC","1045","","","","Protected Payload (KP0)"
"133","0.859067","10.135.49.223","142.251.42.14","QUIC","210","","","","Protected Payload (KP0), DCID=ef14599a66e44a37"
"134","0.940968","142.250.183.138","10.135.49.223","QUIC","66","","","","Protected Payload (KP0)"
"135","1.158496","10.135.49.223","128.119.245.12","TCP","54","1","1","0","[TCP Retransmission] 63276  >  80 [FIN, ACK] Seq=1 Ack=1 Win=256 Len=0"
"136","1.158652","10.135.49.223","128.119.245.12","TCP","54","1","1","0","[TCP Retransmission] 63273  >  80 [FIN, ACK] Seq=1 Ack=1 Win=256 Len=0"
"137","1.174408","10.135.49.223","128.119.245.12","TCP","54","1","1","0","[TCP Retransmission] 63272  >  80 [FIN, ACK] Seq=1 Ack=1 Win=256 Len=0"
"138","1.264489","128.119.245.12","10.135.49.223","TCP","54","1","18229","0","80  >  63344 [ACK] Seq=1 Ack=18229 Win=65664 Len=0"
"139","1.264547","10.135.49.223","128.119.245.12","TCP","1514","40129","1","1460","63344  >  80 [ACK] Seq=40129 Ack=1 Win=65536 Len=1460 [TCP segment of a reassembled PDU]"
"140","1.264547","10.135.49.223","128.119.245.12","TCP","1514","41589","1","1460","63344  >  80 [ACK] Seq=41589 Ack=1 Win=65536 Len=1460 [TCP segment of a reassembled PDU]"
"141","1.264547","10.135.49.223","128.119.245.12","TCP","1514","43049","1","1460","63344  >  80 [ACK] Seq=43049 Ack=1 Win=65536 Len=1460 [TCP segment of a reassembled PDU]"
"142","1.264547","10.135.49.223","128.119.245.12","TCP","1514","44509","1","1460","63344  >  80 [ACK] Seq=44509 Ack=1 Win=65536 Len=1460 [TCP segment of a reassembled PDU]"
"143","1.264547","10.135.49.223","128.119.245.12","TCP","1514","45969","1","1460","63344  >  80 [ACK] Seq=45969 Ack=1 Win=65536 Len=1460 [TCP segment of a reassembled PDU]"
"144","1.264547","10.135.49.223","128.119.245.12","TCP","1514","47429","1","1460","63344  >  80 [ACK] Seq=47429 Ack=1 Win=65536 Len=1460 [TCP segment of a reassembled PDU]"
"145","1.265551","128.119.245.12","10.135.49.223","TCP","54","1","28449","0","80  >  63344 [ACK] Seq=1 Ack=28449 Win=86144 Len=0"
"146","1.265551","128.119.245.12","10.135.49.223","TCP","54","1","34289","0","80  >  63344 [ACK] Seq=1 Ack=34289 Win=97792 Len=0"
"147","1.265633","10.135.49.223","128.119.245.12","TCP","1514","48889","1","1460","63344  >  80 [PSH, ACK] Seq=48889 Ack=1 Win=65536 Len=1460 [TCP segment of a reassembled PDU]"
"148","1.265633","10.135.49.223","128.119.245.12","TCP","1514","50349","1","1460","63344  >  80 [ACK] Seq=50349 Ack=1 Win=65536 Len=1460 [TCP segment of a reassembled PDU]"
"149","1.265633","10.135.49.223","128.119.245.12","TCP","1514","51809","1","1460","63344  >  80 [ACK] Seq=51809 Ack=1 Win=65536 Len=1460 [TCP segment of a reassembled PDU]"
"150","1.265633","10.135.49.223","128.119.245.12","TCP","1514","53269","1","1460","63344  >  80 [ACK] Seq=53269 Ack=1 Win=65536 Len=1460 [TCP segment of a reassembled PDU]"
"151","1.265633","10.135.49.223","128.119.245.12","TCP","1514","54729","1","1460","63344  >  80 [ACK] Seq=54729 Ack=1 Win=65536 Len=1460 [TCP segment of a reassembled PDU]"
"152","1.265633","10.135.49.223","128.119.245.12","TCP","1514","56189","1","1460","63344  >  80 [ACK] Seq=56189 Ack=1 Win=65536 Len=1460 [TCP segment of a reassembled PDU]"
"153","1.265633","10.135.49.223","128.119.245.12","TCP","1514","57649","1","1460","63344  >  80 [ACK] Seq=57649 Ack=1 Win=65536 Len=1460 [TCP segment of a reassembled PDU]"
"154","1.265633","10.135.49.223","128.119.245.12","TCP","1514","59109","1","1460","63344  >  80 [ACK] Seq=59109 Ack=1 Win=65536 Len=1460 [TCP segment of a reassembled PDU]"
"155","1.265633","10.135.49.223","128.119.245.12","TCP","1514","60569","1","1460","63344  >  80 [ACK] Seq=60569 Ack=1 Win=65536 Len=1460 [TCP segment of a reassembled PDU]"
"156","1.265633","10.135.49.223","128.119.245.12","TCP","1514","62029","1","1460","63344  >  80 [ACK] Seq=62029 Ack=1 Win=65536 Len=1460 [TCP segment of a reassembled PDU]"
"157","1.265633","10.135.49.223","128.119.245.12","TCP","1514","63489","1","1460","63344  >  80 [ACK] Seq=63489 Ack=1 Win=65536 Len=1460 [TCP segment of a reassembled PDU]"
"158","1.265633","10.135.49.223","128.119.245.12","TCP","1514","64949","1","1460","63344  >  80 [PSH, ACK] Seq=64949 Ack=1 Win=65536 Len=1460 [TCP segment of a reassembled PDU]"
"159","1.265633","10.135.49.223","128.119.245.12","TCP","1514","66409","1","1460","63344  >  80 [ACK] Seq=66409 Ack=1 Win=65536 Len=1460 [TCP segment of a reassembled PDU]"
"160","1.265633","10.135.49.223","128.119.245.12","TCP","1514","67869","1","1460","63344  >  80 [ACK] Seq=67869 Ack=1 Win=65536 Len=1460 [TCP segment of a reassembled PDU]"
"161","1.265633","10.135.49.223","128.119.245.12","TCP","1514","69329","1","1460","63344  >  80 [ACK] Seq=69329 Ack=1 Win=65536 Len=1460 [TCP segment of a reassembled PDU]"
"162","1.265633","10.135.49.223","128.119.245.12","TCP","1514","70789","1","1460","63344  >  80 [ACK] Seq=70789 Ack=1 Win=65536 Len=1460 [TCP segment of a reassembled PDU]"
"163","1.265633","10.135.49.223","128.119.245.12","TCP","1514","72249","1","1460","63344  >  80 [ACK] Seq=72249 Ack=1 Win=65536 Len=1460 [TCP segment of a reassembled PDU]"
"164","1.265633","10.135.49.223","128.119.245.12","TCP","1514","73709","1","1460","63344  >  80 [ACK] Seq=73709 Ack=1 Win=65536 Len=1460 [TCP segment of a reassembled PDU]"
"165","1.265633","10.135.49.223","128.119.245.12","TCP","1514","75169","1","1460","63344  >  80 [ACK] Seq=75169 Ack=1 Win=65536 Len=1460 [TCP segment of a reassembled PDU]"
"166","1.265633","10.135.49.223","128.119.245.12","TCP","1514","76629","1","1460","63344  >  80 [ACK] Seq=76629 Ack=1 Win=65536 Len=1460 [TCP segment of a reassembled PDU]"
"167","1.265633","10.135.49.223","128.119.245.12","TCP","1514","78089","1","1460","63344  >  80 [ACK] Seq=78089 Ack=1 Win=65536 Len=1460 [TCP segment of a reassembled PDU]"
"168","1.265633","10.135.49.223","128.119.245.12","TCP","1514","79549","1","1460","63344  >  80 [ACK] Seq=79549 Ack=1 Win=65536 Len=1460 [TCP segment of a reassembled PDU]"
"169","1.266142","128.119.245.12","10.135.49.223","TCP","54","1","35749","0","80  >  63344 [ACK] Seq=1 Ack=35749 Win=100736 Len=0"
"170","1.269808","128.119.245.12","10.135.49.223","TCP","54","1","40129","0","80  >  63344 [ACK] Seq=1 Ack=40129 Win=109568 Len=0"
"171","1.286106","10.135.49.223","128.119.245.12","TCP","1514","81009","1","1460","63344  >  80 [ACK] Seq=81009 Ack=1 Win=65536 Len=1460 [TCP segment of a reassembled PDU]"
"172","1.286106","10.135.49.223","128.119.245.12","TCP","1514","82469","1","1460","63344  >  80 [PSH, ACK] Seq=82469 Ack=1 Win=65536 Len=1460 [TCP segment of a reassembled PDU]"
"173","1.286106","10.135.49.223","128.119.245.12","TCP","1514","83929","1","1460","63344  >  80 [ACK] Seq=83929 Ack=1 Win=65536 Len=1460 [TCP segment of a reassembled PDU]"
"174","1.286106","10.135.49.223","128.119.245.12","TCP","1514","85389","1","1460","63344  >  80 [ACK] Seq=85389 Ack=1 Win=65536 Len=1460 [TCP segment of a reassembled PDU]"
"175","1.286106","10.135.49.223","128.119.245.12","TCP","1514","86849","1","1460","63344  >  80 [ACK] Seq=86849 Ack=1 Win=65536 Len=1460 [TCP segment of a reassembled PDU]"
"176","1.286106","10.135.49.223","128.119.245.12","TCP","1514","88309","1","1460","63344  >  80 [ACK] Seq=88309 Ack=1 Win=65536 Len=1460 [TCP segment of a reassembled PDU]"
"177","1.286106","10.135.49.223","128.119.245.12","TCP","1514","89769","1","1460","63344  >  80 [ACK] Seq=89769 Ack=1 Win=65536 Len=1460 [TCP segment of a reassembled PDU]"
"178","1.286106","10.135.49.223","128.119.245.12","TCP","1514","91229","1","1460","63344  >  80 [ACK] Seq=91229 Ack=1 Win=65536 Len=1460 [TCP segment of a reassembled PDU]"
"179","1.334970","142.251.42.14","10.135.49.223","QUIC","1001","","","","Protected Payload (KP0)"
"180","1.337552","142.251.42.14","10.135.49.223","QUIC","169","","","","Protected Payload (KP0)"
"181","1.337801","10.135.49.223","142.251.42.14","QUIC","73","","","","Protected Payload (KP0), DCID=ef14599a66e44a37"
"182","1.671583","128.119.245.12","10.135.49.223","TCP","54","1","47429","0","80  >  63344 [ACK] Seq=1 Ack=47429 Win=124160 Len=0"
"183","1.671707","10.135.49.223","128.119.245.12","TCP","1514","92689","1","1460","63344  >  80 [ACK] Seq=92689 Ack=1 Win=65536 Len=1460 [TCP segment of a reassembled PDU]"
"184","1.671707","10.135.49.223","128.119.245.12","TCP","1514","94149","1","1460","63344  >  80 [ACK] Seq=94149 Ack=1 Win=65536 Len=1460 [TCP segment of a reassembled PDU]"
"185","1.671707","10.135.49.223","128.119.245.12","TCP","1514","95609","1","1460","63344  >  80 [ACK] Seq=95609 Ack=1 Win=65536 Len=1460 [TCP segment of a reassembled PDU]"
"186","1.671707","10.135.49.223","128.119.245.12","TCP","1514","97069","1","1460","63344  >  80 [ACK] Seq=97069 Ack=1 Win=65536 Len=1460 [TCP segment of a reassembled PDU]"
"187","1.671707","10.135.49.223","128.119.245.12","TCP","1514","98529","1","1460","63344  >  80 [PSH, ACK] Seq=98529 Ack=1 Win=65536 Len=1460 [TCP segment of a reassembled PDU]"
"188","1.671707","10.135.49.223","128.119.245.12","TCP","1514","99989","1","1460","63344  >  80 [ACK] Seq=99989 Ack=1 Win=65536 Len=1460 [TCP segment of a reassembled PDU]"
"189","1.671707","10.135.49.223","128.119.245.12","TCP","1514","101449","1","1460","63344  >  80 [ACK] Seq=101449 Ack=1 Win=65536 Len=1460 [TCP segment of a reassembled PDU]"
"190","1.671707","10.135.49.223","128.119.245.12","TCP","1514","102909","1","1460","63344  >  80 [ACK] Seq=102909 Ack=1 Win=65536 Len=1460 [TCP segment of a reassembled PDU]"
"191","1.671707","10.135.49.223","128.119.245.12","TCP","1514","104369","1","1460","63344  >  80 [ACK] Seq=104369 Ack=1 Win=65536 Len=1460 [TCP segment of a reassembled PDU]"
"192","1.671707","10.135.49.223","128.119.245.12","TCP","1514","105829","1","1460","63344  >  80 [ACK] Seq=105829 Ack=1 Win=65536 Len=1460 [TCP segment of a reassembled PDU]"
"193","1.673107","128.119.245.12","10.135.49.223","TCP","54","1","50349","0","80  >  63344 [ACK] Seq=1 Ack=50349 Win=129920 Len=0"
"194","1.673198","10.135.49.223","128.119.245.12","TCP","1514","107289","1","1460","63344  >  80 [ACK] Seq=107289 Ack=1 Win=65536 Len=1460 [TCP segment of a reassembled PDU]"
"195","1.673198","10.135.49.223","128.119.245.12","TCP","1514","108749","1","1460","63344  >  80 [ACK] Seq=108749 Ack=1 Win=65536 Len=1460 [TCP segment of a reassembled PDU]"
"196","1.673198","10.135.49.223","128.119.245.12","TCP","1514","110209","1","1460","63344  >  80 [ACK] Seq=110209 Ack=1 Win=65536 Len=1460 [TCP segment of a reassembled PDU]"
"197","1.673198","10.135.49.223","128.119.245.12","TCP","1514","111669","1","1460","63344  >  80 [ACK] Seq=111669 Ack=1 Win=65536 Len=1460 [TCP segment of a reassembled PDU]"
"198","1.678268","128.119.245.12","10.135.49.223","TCP","54","1","54729","0","80  >  63344 [ACK] Seq=1 Ack=54729 Win=138752 Len=0"
"199","1.678364","10.135.49.223","128.119.245.12","TCP","1514","113129","1","1460","63344  >  80 [ACK] Seq=113129 Ack=1 Win=65536 Len=1460 [TCP segment of a reassembled PDU]"
"200","1.678364","10.135.49.223","128.119.245.12","TCP","1514","114589","1","1460","63344  >  80 [PSH, ACK] Seq=114589 Ack=1 Win=65536 Len=1460 [TCP segment of a reassembled PDU]"
"201","1.678364","10.135.49.223","128.119.245.12","TCP","1514","116049","1","1460","63344  >  80 [ACK] Seq=116049 Ack=1 Win=65536 Len=1460 [TCP segment of a reassembled PDU]"
"202","1.678364","10.135.49.223","128.119.245.12","TCP","1514","117509","1","1460","63344  >  80 [ACK] Seq=117509 Ack=1 Win=65536 Len=1460 [TCP segment of a reassembled PDU]"
"203","1.678364","10.135.49.223","128.119.245.12","TCP","1514","118969","1","1460","63344  >  80 [ACK] Seq=118969 Ack=1 Win=65536 Len=1460 [TCP segment of a reassembled PDU]"
"204","1.678364","10.135.49.223","128.119.245.12","TCP","1514","120429","1","1460","63344  >  80 [ACK] Seq=120429 Ack=1 Win=65536 Len=1460 [TCP segment of a reassembled PDU]"
"205","1.682040","128.119.245.12","10.135.49.223","TCP","54","1","62029","0","80  >  63344 [ACK] Seq=1 Ack=62029 Win=153344 Len=0"
"206","1.682040","128.119.245.12","10.135.49.223","TCP","54","1","66409","0","80  >  63344 [ACK] Seq=1 Ack=66409 Win=162048 Len=0"
"207","1.682040","128.119.245.12","10.135.49.223","TCP","54","1","69329","0","80  >  63344 [ACK] Seq=1 Ack=69329 Win=167936 Len=0"
"208","1.682212","10.135.49.223","128.119.245.12","TCP","1514","121889","1","1460","63344  >  80 [ACK] Seq=121889 Ack=1 Win=65536 Len=1460 [TCP segment of a reassembled PDU]"
"209","1.682212","10.135.49.223","128.119.245.12","TCP","1514","123349","1","1460","63344  >  80 [ACK] Seq=123349 Ack=1 Win=65536 Len=1460 [TCP segment of a reassembled PDU]"
"210","1.682212","10.135.49.223","128.119.245.12","TCP","1514","124809","1","1460","63344  >  80 [ACK] Seq=124809 Ack=1 Win=65536 Len=1460 [TCP segment of a reassembled PDU]"
"211","1.682212","10.135.49.223","128.119.245.12","TCP","1514","126269","1","1460","63344  >  80 [ACK] Seq=126269 Ack=1 Win=65536 Len=1460 [TCP segment of a reassembled PDU]"
"212","1.682212","10.135.49.223","128.119.245.12","TCP","1514","127729","1","1460","63344  >  80 [ACK] Seq=127729 Ack=1 Win=65536 Len=1460 [TCP segment of a reassembled PDU]"
"213","1.682212","10.135.49.223","128.119.245.12","TCP","1514","129189","1","1460","63344  >  80 [ACK] Seq=129189 Ack=1 Win=65536 Len=1460 [TCP segment of a reassembled PDU]"
"214","1.682212","10.135.49.223","128.119.245.12","TCP","1514","130649","1","1460","63344  >  80 [PSH, ACK] Seq=130649 Ack=1 Win=65536 Len=1460 [TCP segment of a reassembled PDU]"
"215","1.682212","10.135.49.223","128.119.245.12","TCP","1514","132109","1","1460","63344  >  80 [ACK] Seq=132109 Ack=1 Win=65536 Len=1460 [TCP segment of a reassembled PDU]"
"216","1.682212","10.135.49.223","128.119.245.12","TCP","1514","133569","1","1460","63344  >  80 [ACK] Seq=133569 Ack=1 Win=65536 Len=1460 [TCP segment of a reassembled PDU]"
"217","1.682212","10.135.49.223","128.119.245.12","TCP","1514","135029","1","1460","63344  >  80 [ACK] Seq=135029 Ack=1 Win=65536 Len=1460 [TCP segment of a reassembled PDU]"
"218","1.682212","10.135.49.223","128.119.245.12","TCP","1514","136489","1","1460","63344  >  80 [ACK] Seq=136489 Ack=1 Win=65536 Len=1460 [TCP segment of a reassembled PDU]"
"219","1.682212","10.135.49.223","128.119.245.12","TCP","1514","137949","1","1460","63344  >  80 [ACK] Seq=137949 Ack=1 Win=65536 Len=1460 [TCP segment of a reassembled PDU]"
"220","1.682212","10.135.49.223","128.119.245.12","TCP","1514","139409","1","1460","63344  >  80 [ACK] Seq=139409 Ack=1 Win=65536 Len=1460 [TCP segment of a reassembled PDU]"
"221","1.682212","10.135.49.223","128.119.245.12","TCP","1514","140869","1","1460","63344  >  80 [ACK] Seq=140869 Ack=1 Win=65536 Len=1460 [TCP segment of a reassembled PDU]"
"222","1.682212","10.135.49.223","128.119.245.12","TCP","1514","142329","1","1460","63344  >  80 [ACK] Seq=142329 Ack=1 Win=65536 Len=1460 [TCP segment of a reassembled PDU]"
"223","1.682212","10.135.49.223","128.119.245.12","TCP","1514","143789","1","1460","63344  >  80 [ACK] Seq=143789 Ack=1 Win=65536 Len=1460 [TCP segment of a reassembled PDU]"
"224","1.682212","10.135.49.223","128.119.245.12","TCP","1514","145249","1","1460","63344  >  80 [ACK] Seq=145249 Ack=1 Win=65536 Len=1460 [TCP segment of a reassembled PDU]"
"225","1.682212","10.135.49.223","128.119.245.12","TCP","1514","146709","1","1460","63344  >  80 [PSH, ACK] Seq=146709 Ack=1 Win=65536 Len=1460 [TCP segment of a reassembled PDU]"
"226","1.682212","10.135.49.223","128.119.245.12","TCP","1514","148169","1","1460","63344  >  80 [ACK] Seq=148169 Ack=1 Win=65536 Len=1460 [TCP segment of a reassembled PDU]"
"227","1.682212","10.135.49.223","128.119.245.12","TCP","1514","149629","1","1460","63344  >  80 [ACK] Seq=149629 Ack=1 Win=65536 Len=1460 [TCP segment of a reassembled PDU]"
"228","1.683464","128.119.245.12","10.135.49.223","TCP","54","1","76629","0","80  >  63344 [ACK] Seq=1 Ack=76629 Win=179584 Len=0"
"229","1.683464","128.119.245.12","10.135.49.223","TCP","54","1","81009","0","80  >  63344 [ACK] Seq=1 Ack=81009 Win=181632 Len=0"
"230","1.683961","128.119.245.12","10.135.49.223","TCP","54","1","82469","0","80  >  63344 [ACK] Seq=1 Ack=82469 Win=183296 Len=0"
"231","1.689951","128.119.245.12","10.135.49.223","TCP","54","1","83929","0","80  >  63344 [ACK] Seq=1 Ack=83929 Win=183296 Len=0"
"232","1.689951","128.119.245.12","10.135.49.223","TCP","54","1","89769","0","80  >  63344 [ACK] Seq=1 Ack=89769 Win=179584 Len=0"
"233","1.690094","128.119.245.12","10.135.49.223","TCP","54","1","92689","0","80  >  63344 [ACK] Seq=1 Ack=92689 Win=177664 Len=0"
"234","1.690979","10.135.49.223","128.119.245.12","TCP","1514","151089","1","1460","63344  >  80 [ACK] Seq=151089 Ack=1 Win=65536 Len=1460 [TCP segment of a reassembled PDU]"
"235","1.690979","10.135.49.223","128.119.245.12","TCP","1514","152549","1","1460","63344  >  80 [ACK] Seq=152549 Ack=1 Win=65536 Len=1460 [TCP segment of a reassembled PDU]"
"236","1.690979","10.135.49.223","128.119.245.12","TCP","1514","154009","1","1460","63344  >  80 [ACK] Seq=154009 Ack=1 Win=65536 Len=1460 [TCP segment of a reassembled PDU]"
"237","1.690979","10.135.49.223","128.119.245.12","TCP","1514","155469","1","1460","63344  >  80 [ACK] Seq=155469 Ack=1 Win=65536 Len=1460 [TCP segment of a reassembled PDU]"
"238","1.690979","10.135.49.223","128.119.245.12","TCP","1514","156929","1","1460","63344  >  80 [ACK] Seq=156929 Ack=1 Win=65536 Len=1460 [TCP segment of a reassembled PDU]"
"239","1.690979","10.135.49.223","128.119.245.12","TCP","1514","158389","1","1460","63344  >  80 [ACK] Seq=158389 Ack=1 Win=65536 Len=1460 [TCP segment of a reassembled PDU]"
"240","1.690979","10.135.49.223","128.119.245.12","TCP","1514","159849","1","1460","63344  >  80 [ACK] Seq=159849 Ack=1 Win=65536 Len=1460 [TCP segment of a reassembled PDU]"
"241","1.690979","10.135.49.223","128.119.245.12","TCP","1514","161309","1","1460","63344  >  80 [ACK] Seq=161309 Ack=1 Win=65536 Len=1460 [TCP segment of a reassembled PDU]"
"242","1.690979","10.135.49.223","128.119.245.12","TCP","1514","162769","1","1460","63344  >  80 [ACK] Seq=162769 Ack=1 Win=65536 Len=1460 [TCP segment of a reassembled PDU]"
"243","1.690979","10.135.49.223","128.119.245.12","TCP","1514","164229","1","1460","63344  >  80 [PSH, ACK] Seq=164229 Ack=1 Win=65536 Len=1460 [TCP segment of a reassembled PDU]"
"244","1.690979","10.135.49.223","128.119.245.12","TCP","1514","165689","1","1460","63344  >  80 [ACK] Seq=165689 Ack=1 Win=65536 Len=1460 [TCP segment of a reassembled PDU]"
"245","1.690979","10.135.49.223","128.119.245.12","TCP","1514","167149","1","1460","63344  >  80 [ACK] Seq=167149 Ack=1 Win=65536 Len=1460 [TCP segment of a reassembled PDU]"
"246","1.690979","10.135.49.223","128.119.245.12","TCP","1514","168609","1","1460","63344  >  80 [ACK] Seq=168609 Ack=1 Win=65536 Len=1460 [TCP segment of a reassembled PDU]"
"247","1.690979","10.135.49.223","128.119.245.12","TCP","1514","170069","1","1460","63344  >  80 [ACK] Seq=170069 Ack=1 Win=65536 Len=1460 [TCP segment of a reassembled PDU]"
"248","1.690979","10.135.49.223","128.119.245.12","TCP","1514","171529","1","1460","63344  >  80 [ACK] Seq=171529 Ack=1 Win=65536 Len=1460 [TCP segment of a reassembled PDU]"
"249","1.690979","10.135.49.223","128.119.245.12","TCP","1514","172989","1","1460","63344  >  80 [ACK] Seq=172989 Ack=1 Win=65536 Len=1460 [TCP segment of a reassembled PDU]"
"250","1.690979","10.135.49.223","128.119.245.12","TCP","1514","174449","1","1460","63344  >  80 [ACK] Seq=174449 Ack=1 Win=65536 Len=1460 [TCP segment of a reassembled PDU]"
"251","1.690979","10.135.49.223","128.119.245.12","TCP","1514","175909","1","1460","63344  >  80 [ACK] Seq=175909 Ack=1 Win=65536 Len=1460 [TCP segment of a reassembled PDU]"
"252","1.690979","10.135.49.223","128.119.245.12","TCP","1514","177369","1","1460","63344  >  80 [ACK] Seq=177369 Ack=1 Win=65536 Len=1460 [TCP segment of a reassembled PDU]"
"253","1.690979","10.135.49.223","128.119.245.12","TCP","1514","178829","1","1460","63344  >  80 [ACK] Seq=178829 Ack=1 Win=65536 Len=1460 [TCP segment of a reassembled PDU]"
"254","1.690979","10.135.49.223","128.119.245.12","TCP","1514","180289","1","1460","63344  >  80 [PSH, ACK] Seq=180289 Ack=1 Win=65536 Len=1460 [TCP segment of a reassembled PDU]"
"255","1.690979","10.135.49.223","128.119.245.12","TCP","1514","181749","1","1460","63344  >  80 [ACK] Seq=181749 Ack=1 Win=65536 Len=1460 [TCP segment of a reassembled PDU]"
"256","1.690979","10.135.49.223","128.119.245.12","TCP","1514","183209","1","1460","63344  >  80 [ACK] Seq=183209 Ack=1 Win=65536 Len=1460 [TCP segment of a reassembled PDU]"
"257","1.690979","10.135.49.223","128.119.245.12","TCP","1514","184669","1","1460","63344  >  80 [ACK] Seq=184669 Ack=1 Win=65536 Len=1460 [TCP segment of a reassembled PDU]"
"258","1.690979","10.135.49.223","128.119.245.12","TCP","1514","186129","1","1460","63344  >  80 [ACK] Seq=186129 Ack=1 Win=65536 Len=1460 [TCP segment of a reassembled PDU]"
"259","1.690979","10.135.49.223","128.119.245.12","TCP","1514","187589","1","1460","63344  >  80 [ACK] Seq=187589 Ack=1 Win=65536 Len=1460 [TCP segment of a reassembled PDU]"
"260","1.690979","10.135.49.223","128.119.245.12","TCP","1514","189049","1","1460","63344  >  80 [ACK] Seq=189049 Ack=1 Win=65536 Len=1460 [TCP segment of a reassembled PDU]"
"261","1.690979","10.135.49.223","128.119.245.12","TCP","1514","190509","1","1460","63344  >  80 [ACK] Seq=190509 Ack=1 Win=65536 Len=1460 [TCP segment of a reassembled PDU]"
"262","1.690979","10.135.49.223","128.119.245.12","TCP","1514","191969","1","1460","63344  >  80 [ACK] Seq=191969 Ack=1 Win=65536 Len=1460 [TCP segment of a reassembled PDU]"
"263","1.690979","10.135.49.223","128.119.245.12","TCP","1514","193429","1","1460","63344  >  80 [ACK] Seq=193429 Ack=1 Win=65536 Len=1460 [TCP segment of a reassembled PDU]"
"264","1.690979","10.135.49.223","128.119.245.12","TCP","1514","194889","1","1460","63344  >  80 [ACK] Seq=194889 Ack=1 Win=65536 Len=1460 [TCP segment of a reassembled PDU]"
